,날짜,리뷰,평점
0,2020.05.06 20:13,이것은... 사진 세울 때 쓰는 겁니다ㅎ,10
1,2020.05.09 23:25,나라면 그냥 12년 살았을듯....쫄려 죽는줄..,10
2,2020.05.06 11:02,영화 재밌습니다. 다니엘 래드클리프 완전 열연이네요. 열쇠맞출때마다 몰입감과 긴장감이 공존하는데 꿀잼입니다. 올해 본 영화 중 탑 3에 들어감. 저게 실화라는게 더 놀랍네요.,10
3,2020.05.06 14:47,심장 쫄리는 수준이 장난 아님. 말도 안 되는 것 같은데 실화라니 더 충격,10
4,2020.05.06 14:45,다니엘 래드클리프.. 이제는  배우로 도약하는거같다,10
5,2020.05.06 11:37,코로나 탈출 방탈출 같이 갇힌 공간을 탈출하고 싶은 그 맘이 커서 그런지 재밌게 봤음 방탈출카페 가고 싶다,10
6,2020.05.06 15:22,껌으로 열쇠 붙일때가 젤 긴장감 있었다ㅋㅋㅋ 스토리는 실화기반이라 독특한 느낌은 없었다. 쇼생크 탈출류의 감옥이야기,7
7,2020.05.06 12:44,몰입도라든가 연출이좋음,8
8,2020.05.07 22:22,그동안 봐온 감옥탈출 영화중 가장 소박했지만 열쇠라는 작은 매체 하나만으로 이렇게 스릴을 유도하는 경우는 개인적으로 처음 봐서 실화이지만서도 참신하게 다가온 작품이었습니다.,9
9,2020.05.11 07:29,영화속에 실제 탈출 주인공 나온다. . . 면회하는 장면. . . 잘바바요,10
10,2020.05.06 19:59,진짜 너무 재밌음 제빌 봐주세요 부탁임 이건 꼭 뵈야됨 콜라 빨대 오무리면서 봤네 ㅋㅋㅋㅋ,10
11,2020.05.09 20:39,"긴장감,몰입감, 통쾌함을 느낀  재미난영화",8
12,2020.05.06 15:14,"위험을 무릅쓰고 행동하는 자만이, 자유를 만끽하는법",9
13,2020.05.16 21:52,배우들이 대사를 하는 시간보다 숨소리를 내는 시간이 더많은 영화오히려 그런 상황이 보는 입장에서 더긴장하게 만듬.쇼생크 탈출을 보러 왔다가  이스케이프 플랜(실버스타 스텔론)의 과거 버전을 보고 온듯한 기분,7
14,2020.05.06 15:05,이게 실화라니... 진짜 대단하다.. ㄷㄷ,9
15,2020.05.10 19:14,실화인데 영 믿기지가 않은 영화,8
16,2020.05.15 16:46,처음부터 끝까지 심장이 아주 쫄깃쫄깃 조여온다..,8
17,2020.05.13 16:09,이야 몰입감쩔고 개쫄림 탈옥과정을 잘 표현함,8
18,2020.05.24 17:20,같이 탈옥 한번 한것 같은 기분,9
19,2020.05.06 11:39,오 다니엘 래드클리프 인생 영화!  재밌어요~~,10
20,2020.05.06 14:48,"실화라는게 믿겨지지 않을 정도로 영화같은 스토리였네요, 코로나 때문에 오랜만에 간 극장이였는데 후회 없습니다",9
21,2020.05.06 13:34,이런 영화 처음이네~,10
22,2020.05.06 14:53,긴장감 넘치는 연출로 몰입감이 좋아 시간가는 줄 모르고 빠져서 보게됩니다. 특히 실화를 리얼하게 살려낸 연출에 찬사를 보냅니다.,8
23,2020.05.10 21:36,영화 볼 게 없어서 고른 건데 과몰입해서 봤음열쇠 껌으로 주울 때 긴장돼서 발가락을 가만히 두질 못하고 ㅋㅋㅋ,7
24,2020.05.07 21:11,아들과 봤음 조마조마 조마조마 실화 라니 정말 ...,8
25,2020.05.06 15:00,탈출영화 좋아해서 봤는데 직접 열쇠를 만들어버리는 클라쑤 ㅋㅋㅋㅋ 새로운 느낌이었는데 실화였다니 더 소름! 그 와중에 연기도 잘함,9
26,2020.05.11 03:18,가학적인 장면 없이도 충분히 괴로운 영화 시종일관 꽉 죄어오는 긴장감이 관객을 괴롭힌다.,7
27,2020.05.08 18:38,끝나는시간까지맘졸이며재미있게봤어요.실화가바탕이라고했으나내용을모르고가서인지보는내 긴장의시간이었어요.추천합니다~,10
28,2020.05.08 02:09,상황이 너무 맞아떨어지는 느낌도 들지만 탈출과정이 주는 몰입감은 최고... 더러운 장면 하나 있어서 별 하나 깎음,8
29,2020.05.14 11:09,생각보다 자극적인 탈출 장면은 없어서 아쉽지만 들킬까봐 심장 쫄린 장면은 많았다. 보통 생각하는탈출극이다만 긴장감 있는 탈출을 보고 싶다면 추천,7
30,2020.05.17 04:38,"그저 무미건조하게 탈출만 기다리게 되는, 툭툭 예상되는 긴장감만 던져주고 기대감도 궁금증도 안생겼던 영화..",5
31,2020.05.08 10:58,15개의 강철문을 뚫는건 오로지 열쇠뿐!!!...시종 가슴을 조여오는 긴장감은 압권이다!!!...유색인종 인권운동으로 실형을 받은 두명의 백인!그들의 탈출은 부당함에 맞서는 유일한 방법!실화가 주는 진정성은 울림이 있는 감동을 준다! ,10
32,2020.05.07 19:47,해리포터의 아즈카반 탈출 영화화 ㅋ,9
33,2020.05.10 19:55,와 마지막 문 부수는거에서 심장 터지는줄...,10
34,2020.05.25 22:34,진짜 짜릿해 ~~~~ 요,10
35,2020.05.14 12:25,공포영화 보다도 더 심장터질뻔!,10
36,2020.05.30 17:38,더이상 해리포터가 생각나지 않는 한 명의 배우가 된 다니엘 레드클리프.,8
37,2020.05.08 03:24,해리포터 이후 다니엘 래드클리프 작품 중에서 제일 나은듯 긴장감 장난아님,8
38,2020.05.10 23:07,정적인 플롯이라고 생각했는데 생각보다 긴장감 넘치고 몰입됨. 재밌음,7
39,2020.05.15 16:30,거짓말같은 실화라서 열쇠하나만으로도상영내내 긴장감 최고!인권운동가들에게응원과 박수를 보냅니다,10
40,2020.05.14 18:54,그들이 웃고나서야 참았던 긴장이 풀렸다,9
41,2020.05.11 00:52,보다가 심장병 걸릴뻔,9
42,2020.05.16 08:55,와~ 심장 쫄깃해 죽는줄 알았다... 이게 진짜 실화? 감옥 탈출 영화의 최고봉!,10
43,2020.05.16 23:05,극장에서 봐야하는 영화 was the best !:),10
44,2020.05.06 17:04,몰입도가 좋아서 재미있게 잘봤습니다~,9
45,2020.05.20 23:58,이게 실화라는게 신기했고 누구한명은 잡히겠지했는데 다탈옥성공하는게 놀라웠다. 열쇠열때마다 웬만한 공포영화들보다 무서웠음,10
46,2020.05.06 14:46,내용도 재미있고 특히 실화라는게 ㅋㅋ임팩트 있었습니다,10
47,2020.05.24 21:39,이거 보면 정말 아집과 집념만 있으면 세상에 못할게 없는거같다..,10
48,2020.05.24 22:31,해리포터 드디어 해리포터이미지가 없어지는 영화였다. 연기 정말 환상적,10
49,2020.05.24 21:10,결말을 아는데도 쫄리면서보는영화,8
50,2020.05.24 01:13,현실에 저항하는 것이 우리나라 독립운동가들 같기도 해서 응원(?)하면서 봤네요. 실화라는 게 놀랍고 강한 저항의지에 감동받았어요. 지루할 틈 없이 스릴있어요.,10
51,2020.05.18 21:48,글쎄...이게 10점짜리는 아닌거같은데,6
52,2020.05.12 04:52,뭐가됐든 일단 밖에 나가서 좀 하자 해리야!!! 아유 내심장아,10
53,2020.06.07 19:53,이게 다 지팡이가 없어서 일어난 일입니다.알로호모라 하나면 끝인데 하하핫,10
54,2020.06.07 13:16,인종차별에 저항하는 역사적 운동을 좀 더 부각시켰으면 영화의 주제의식이 더 들어났을텐데 탈출과정에만 지나치게 집중하여 영화가 주는 메시지의 전달력이 반감된다,6
55,2020.06.02 21:00,빗자루 타고 탈옥하면 끝인데,10
56,2020.05.23 23:31,영화 보면서 평점 처음 남겨요 진짜... 너무 재미있었습니다 영화를 보기 전 평점을 보고 갔음에도 처음부터 끝까지 심장 쫄깃함이 이어지고 영상미 진짜 몰입할 수 있게 만든 감독... 상 줘야 돼요 너무 재미있게 봤습니다 영화관에서 꼭 보세요 ,8
57,2020.05.17 00:55,긴장감이 말이 필요없어요 꼭 보세요 간만에 인생영화 등극,10
58,2020.05.16 23:21,보다가 심장떨려서 죽을뻔했어용 꿀잼 ㅋㅋㅋ,10
59,2020.05.14 21:15,영화를 끝까지 보고 나서도 이게 실화라는 게 믿기지 않을 정도로 정말 놀라운 감옥 탈출기를 보여주는데요. 단순한 스토리지만 끝까지 숨 막히는 전개에 아직 못 보셨다면 꼭 챙겨 보시라고 강추 드릴만 한 영화였습니다.,10
60,2020.05.14 01:12,실화라는 것이 놀랍고 탈옥의 기구가 생소한 것이 또 한번 놀랐어요,8
61,2020.05.11 15:07,몰입도가 엄청나다... 진짜 조마조마하고;,10
62,2020.05.30 23:03,진짜 간 쫄깃 쫄깃 ㅋㅋㅋ 문하나 열릴때마다 가슴이 콩닥콩닥,10
63,2020.05.24 19:59,"약간 소금이 안들어간 계란 후라이 같앴음.지금도 괞찮은데 뭔가 조금 더 뭔가 (액션, 코미디)같은 요소들이 들어가면 더 재밌었을 듯.",8
64,2020.05.08 10:02,재밌어요 다만 탈출과정만 그려서 ㅠ인종차별 배경을 좀더 다뤘으면 하는 아쉬움이,6
65,2020.06.05 23:47,알라호모라 주문을 잊어버린 해리의 탈출기,10
66,2020.06.04 17:04,오랜만에 스릴있게 본 것 같아용 최고 ~!!,10
67,2020.06.01 06:26,"실화라는 것을 감안하고 봐야합니다. 실화임을 감안하면 8.5점, 의도적으로 창작된 일반적인 영화들 정도를 기대하면 6.5점 정도로 느껴질 것 같습니다. 스토리에 여러 장치를 의도적으로 넣을 수 있는 일반적인 영화 들에 비하면 스토리가 아주 심플합니다. 그런 스토리를 흠잡을 곳 없는 연출과 연기로 커버해 서스펜스를 극한으로 끌어올렸습니다. 긴장감을 충분히 전달 받아 깊게 몰입할 수 있었고, 심지어 현장감을 느꼈습니다. 마지막엔 덩달아 맥이 탁 풀려 눈물이 차오르며 감동을 느꼈습니다. 박수를 짝짝짝짝 치고 싶었는데 조용히 손바닥을 톡톡 두드렸습니다. 팔리기 위한 영화들만 봐오다가 정말 작품을 봤다는 느낌이 들었습니다. 영화관까지 가서 볼 가치가 있냐 물으면 그건 잘 모르겠지만, 이렇게 까지 깊은 몰입감으로 승부하는 영화는 스크린이 그 장점을 최대한 부각시킨다고 생각합니다. ",9
68,2020.05.17 19:14,마스크 쓰고 있으니 숨을 더 잘 쉴수 없어서 더 쫄렸다,10
69,2020.05.13 13:26,심장이 쫄깃쫄깃 10자,10
70,2020.05.09 09:45,열쇠장인의 어드벤처 스릴러! 긴장감 좋쿠요 ㅋㅋㅋ 재밌습니다. 내 평생 열쇠따는거에 그렇게 긴장할줄 몰랐습니다 ㅋㅋ,10
71,2020.05.29 23:54,실화라는점에서 10점이다,10
72,2020.05.28 23:22,혼영으로 봐도 후회 없어요 ㅎ,10
73,2020.05.23 18:44,"별거없는거 같은데 계속해서 심장이 쫄깃하고 손을 가만히 둘수 없었다. 왜이렇게 불안하고 초조하고 떨리던지..!!!오롯이 영화에 빠져들 수 있었다. BGM도 한 몫 하는 듯 하다.별기대없이 봤던터라 만족감이 높을 수 있으나, 추천할만한 작품이었다!! ",10
74,2020.05.14 18:16,그저 미쳤다.... 와...,10
75,2020.05.24 22:22,마치 내가 탈출하는듯한  느낌!,10
76,2020.05.06 14:47,실화 개미쳤네,9
77,2020.06.05 05:10,해리포터 이녀석 보면 볼수록 연기가 참 좋아..,10
78,2020.06.04 20:29,,10
79,2020.06.04 19:55,계속 조마조마조마조마,10
80,2020.06.04 08:57,심장 개쫄렸다...  진짜,10
81,2020.06.04 05:30,오오 꿀잼. 기대이상입니다,10
82,2020.06.03 17:18,해리포터의 프리즌 이스케이프 / 헤르미온느의 콜로니아 둘다 최고네요~!,9
83,2020.06.03 09:45,대체로 무난하나 너무 무난해서 문제결말이 예측된다는 점에서 그닥 큰 흥미는 없었다.,6
84,2020.06.03 09:31,"재미있고, 스릴이 넘쳐서 영화볼동안 화장실도 못갔습니다, 나무로 열쇠를 만든다는 새롭고 신박한 방식이 재미있었습니다. 특히 보통 실제 역사를 기반으로 하면 그렇게 신박하지는 않는데 그 신박하지 않는다는 감을 깨 부수...",10
85,2020.06.02 05:19,숨쉴수가없음.. 심장 쫄깃쫄깃,10
86,2020.05.31 22:42,간절함이 무엇인지 알게해준 영화,10
87,2020.05.31 22:15,감옥 교도소라는 특정 공간에서 벌여지는 비밀리에 계획하고 진행한 탈출 장면과 들키지 않을까?  생각되는 극한의 긴장과 공포감이 영화를 보는 시간 내내 과몰입 할 정도로 지루 할 틈이 없었 던 것 같다~@,10
88,2020.05.31 21:57,보는동안 심장쫄려서 죽는줄;;배우들 연기도 좋았고 실화라니 정말 더 놀랐습니다!,10
89,2020.05.30 16:45,"열쇠 소리, 문여는 소리가 영화의 가장 극적인 요소",9
90,2020.05.26 21:30,체감 1년은 늙은 것 같은 긴장감과 몰입감,8
91,2020.05.25 02:40,"해리포터가 프리토리아 감옥 탈출하는 영화. 실화 기반이라 내가 몰랐던 남아공 아파르트헤이트에 관련된 역사에 대해 알 수 있어서 좋았다. 영화 다보고 나중에 아파르트헤이트에 대해서 찾아봐야 겠다고 생각하면서 영화를 봤다. 근데 감옥 중간 탈출 과정이 생략된게 너무 많아서 좀 별로였다. 뭐랄까 긴장감은 있는데 열쇠 만드는 과정같은게 갑자기 중간과정 생략되고 감옥 101일째 이렇게 나오면서 다 생략되어서 조금 아쉬웠다. 그래도 시간가는줄 모르고 몰입해서 보았고, 마지막에 감옥 탈출할때는 나름 긴장감 있었다. ",7
92,2020.05.25 00:36,우리가 잊지말아야할 선한분노,9
93,2020.05.24 11:23,긴장감은 최고인데 내용은 별거 없어요그냥 감옥탈출하고 끝나는 내용..,6
94,2020.05.23 23:32,긴장감만큼은 인정하는 부분이다,7
95,2020.05.23 06:51,"스릴 넘치는 탈옥장면, 그들에게는 자유와 정의가 있었다.마지막 장면에서 나도 모르게 승리의 탄성을..",9
96,2020.05.22 22:52,"탈옥물 특유의 두뇌싸움 보다, 실화에서 주는 쫄깃한 긴장감을 강조했다. 감동서사를 뺀 쇼생크 탈출 느낌이다. 캐릭터들의 서사가 무척 궁금한데, 그쪽으로는 별 조명을 안해줘서 아쉽. 다니엘 래드클리프의 해리포터 이미지 탈출기로도 볼만하다. ",8
97,2020.05.22 16:38,보는 내내 쫄깃쫄깃 했다.이게 실화라는 점 에서 또 한번 놀라웠다,9
98,2020.05.20 19:38,아 누군가 했더니 해리포터구나,10
99,2020.05.20 19:16,다니엘 해리포터랑 오버랩 한번도 안될만큼 연기력 미쳐돌아가셨고 실화바탕이라 자칫하면 그저 흘러가는대로 지나갔을 내용이 연출미쳐서 보는내내 지릴뻔 했습니다. 제발봐주세요 진짜 아 진짜 아직도 긴장감이 안가셤ㅎ어요,10
100,2020.05.19 20:47,대머리 분명 나갈수 있었는데 안나감(가족사진 볼때 나갈려고 결심하는 줄 앎)많은 생각을 하게 만드는 영화...,10
101,2020.05.17 20:28,영화가 마치는 순간까지 정말 몰입해서 봤습니다,10
102,2020.05.17 00:11,"다니엘 래트클리프 나와서 해리포터 생각나서 집중안될줄알았는데 전혀 아니었습니다 해리포터는 잊게만드는연기실력,,,  너무재밌게봤네요 코로나땜시 오랜만에 영화관가서 좋은 경험했네요",10
103,2020.05.16 22:01,심장 쫄깃쫄깃 쪼그라드는줄,9
104,2020.05.16 21:14,찐 재미잇음 강추ㅠ잼재맺ㅁ,10
105,2020.05.16 19:14,보는 내내 심장쫄리면서 봤다.결국 다 보고 생각나는건 인종차별이 정말 하루라도 빨리 없어져야한다는 생각이 들었다.,10
106,2020.05.15 23:45,기대를 안하고 봤는데 처음부터 끝까지 숨 쉬기 힘든 긴장감에 영화 끝나고 나오고 나서도 여운이 가시질 않네요,10
107,2020.05.15 18:16,5 / 15일 ~  정말 재미 있게 봤습니다 .긴장감 최고  ~ 강력추천 합니다 .,10
108,2020.05.14 01:08,몰입도 ㄷㄷ 긴장되서 손에 땀 남,10
109,2020.05.14 01:07,쫄깃쫄깃 두근두근 동료들과 팀플레이 멋지네요,8
110,2020.05.13 22:47,감동적인 영화임 적극 추전,10
111,2020.05.13 19:28,실화  + 실존 인물과 진짜 비슷한 캐스팅에쫄깃쫄깃하면서 봤습니다.... 탈옥영화중 손꼽힐듯,10
112,2020.05.12 22:32,"열쇠방사장님들, 한번쯤 보고 피식할영화.",10
113,2020.05.12 19:35,해리포터 이미지를 벗기위해 연기변신한 다니엘 래드클리프의 열연이 제대로 보였고 탈출씬마다 몰입감이 제대로 닿은 영화,10
114,2020.05.12 01:25,드디어 해리포터가 안보인다. 건즈아킴보같은거 찍지말고 이런거 많이찍자,8
115,2020.05.11 15:51,다니엘 래드클리프의 연기는 예전부터도 좋아했지만 이번 영화에서 더 빛을 발한거 같아요 실화소재라서 더 긴장감 넘치고 나중에는 같이 긴장하면서 봤어요 올 상반기 영화중에 최고인거 같아요,10
116,2020.05.10 22:54,긴장감 최고. 연기력도 최고. 팀이 다했네,10
117,2020.05.10 16:53,실화 기반이라 더 재밌었음! 만델라 대통령이 남아프리카 대통령으로 취임하기까지 엄청난 고난이 있었겠네요ㅠㅠ,10
118,2020.05.10 05:59,실화라서 더 신기하다.,7
119,2020.05.09 22:00,긴장감 넘치는 해리포터의 연기,8
120,2020.05.09 21:02,다니엘 래드클리프는 해리포터 때부터 느꼈지만 긴장하는 연기를 참 잘한다... 달달달 떠는데 내 심장까지 요동침,9
121,2020.05.09 18:06,스릴있고 쪼는 맛이 있음~!,9
122,2020.05.09 16:53,진짜 손에 땀이 쥐고 예상을 빗나가는 영화 와 정말 잘 봤습니다 ㅋㅋㅋ와 스릴,10
123,2020.05.09 10:01,"404일의 투옥기간중 자유에 대한 열망과 굳은 의지, 뛰어난 재주로 이루는 탈옥 이야기를 너무나 실감나게 만든 영화",10
124,2020.05.08 15:59,70년대 남아공 관련 내용이라 잘 모르겠지만 배우들 열연이 돋보이네요,7
125,2020.05.08 09:03,긴장장 몰입도 좋음.  현실적이고 과장없이 그대로인듯한 자연스러움.,9
126,2020.05.08 03:46,보는내내 스릴 넘치네요~보면서 계속 빨리빨리 외치게 되는 영화.,8
127,2020.05.06 23:41,명작급은 아니지만 재밌다 봐도 된다,8
128,2020.05.06 17:14,이게 실화라니 미쳤네요...개인적으로 좋아하는 연출스타일이라 더 좋았어요!,10
129,2020.05.06 16:58,전체적으로 균형잡힌 영화였어요잘 보고 갑니다~,10
130,2020.05.30 16:11,코로나 아니었으면 500만 이상각..,10
131,2020.05.24 13:15,정말 영화같은데 실화라 더욱 대단,10
132,2020.05.21 15:32,막 재밌는 내용은 아니지만 볼만하고스릴있기보단 전체적인 스토리가 맘에 들어요좋습니다,8
133,2020.05.19 21:29,배우들의 섬세한 연기가 너무 좋았습니다.떨림에서 느껴지는 긴장감과 언제 터질지 모르는 긴박감에 집중해서 보게 되었습니다.무엇보다 실화를 바탕으로 되어 있다는게 저 같은 현실주의자에게는 더 보기 편안했던 영화였습니다....,8
134,2020.05.14 21:13,처음부터 끝까지 긴장하면서 봄인생영화,10
135,2020.05.11 14:00,긴장감이나 배우들 연기 쩐다야,10
136,2020.05.10 18:14,실화라서 그런지 더 몰입해서 봤어요.배우들의 연기력이 엄청납니다.,8
137,2020.05.07 17:56,사람놀래키는 장면없이 SMOOTH하게 흘러가서 무난하다 느껴질지 모르지만 실화라고 생각하면 그 자체가 흥미로워지는 영화.,7
138,2020.05.06 16:42,기대 없었는데 재밌습니다~ ㅎㅎ,10
139,2020.05.06 15:15,요즘 볼 만한 영화 없었는데 오랜만에 좋은 작품 한 편 봤네요,10
140,2020.05.06 15:03,영화가 긴장감이 넘쳐서 한번 보면 끝까지 보게 됨! 강추!!,10
141,2020.05.23 17:28,열쇠만드는 이야기인듯,6
142,2020.06.09 21:26,아주심장이쫄깃해서 심장마비올듯,10
143,2020.06.08 03:36,왜탈출 하려는지 알겠다 뒷문이랑 정문이랑 개가까움ㅋㅋㅋ 정문이 바로 민간세상이고ㅋㅋ 이거 보고나니 열쇄기공사 될거같다;;;;,5
144,2020.06.08 02:53,와 긴장감 대박.. 코로나19영향으로 볼만한영화가 없는 요즘.. 간만에 잼나는 영화가~ 출연진도 빵빵하고 좋았음.,10
145,2020.06.07 23:48,'실화'라는 말이 주는 묵직한 설득력과 긴장감.,8
146,2020.06.07 18:54,아 진짜 얼마나 긴장되는지 탈옥 시도할때 내가 다 다 쫄리더라...,9
147,2020.06.07 04:24,열쇠만드는 게 직업이신 분이 분명하다 심장 쪼그라들뻔,10
148,2020.06.07 01:18,오랜만에 영화다운 영화를 본 느낌,9
149,2020.06.06 22:29,영화 보는 내내 그 현장에 잇엇던거 같앗어요. 해리포터가 생각이 안나는 다니엘의 연기 잘봣습니다 !,10
150,2020.06.06 21:23,보는 내내 발각될까봐 심장을 부여잡고 봤네요..영화 내내 긴장감 스릴 넘 최고였습니다..그 탈출은 그당시나 가능하지 않았나 싶네요..cctv 나 전자열쇠가 없었던 시절이 그들에겐 행운이 아나였나 싶어요..너무 잘봤습니다~~^^☆ ,10
151,2020.06.06 14:54,긴장감이 최고다. 11년사냐 36년 사냐 선택을 어떻게 해ㅋㅋㅋ 간수들은 진짜 허술함,7
152,2020.06.06 02:57,영화 마지막 20분은 심장이 너무 뛰어서 숨이 찻다는. 그럼 뭐하나 그런 처절한 역사에도 불구하고 요즘 다시 벌어지는 인종차별 상황을 보면 끝나지 않는 전쟁인건지 안타까울 뿐이다.,9
153,2020.06.06 01:50,영화 흐름과 상황에 몰입할 수 있다면 정말 식은땀이 날 정도로 쫄깃합니다.,10
154,2020.06.05 20:03,이거보고 수명이 10년 단축 되었습니다 날 죽여라 차라리,10
155,2020.06.05 18:06,생각보다 긴장감과 완성도가 놓다,7
156,2020.06.04 23:27,끝까지 긴장감을 놓칠 수 없는 영화...,10
157,2020.06.04 22:12,와 그냥 말 할 필요가 없음 개꿀 무조건 보세요 와 개쩐다,10
158,2020.06.04 16:33,,6
159,2020.06.04 16:27,"7.7 어제 봤던 작품, 실화를 배경으로해서인지 다른 탈출영화들과는 다른 긴장감을 일으킨다 쇼생크탈출과 같은 작품, 남아프리카의 인종차별 역사를 알고 본다면 좀 더 재미있고 알차게 볼 수 있는 영화, 해리포터도 잘 컸고 연기도 뛰어났다,  열쇠하나로 심장쪼들리게 하는 영화는 정말 처음이었다 킬링타임용으로 제격 그러나 너무 많이 기대는하지말길 ",7
160,2020.06.04 01:46,스릴이 최고 보다가 후회했음  숨도 자꾸 참게되고 우와 쫄려서.,10
161,2020.06.04 01:16,와 탈출물 이렇게 재밌게본거 없는데ㅋㅋㅋ 재밌다,10
162,2020.06.03 17:06,평점남기는거 처음인데 개인적으로 재밌게 봤고... 대단 한거같아요 ㅠㅠㅠ 배우들이 연기를 잘해서 몰입 쩔었...,10
163,2020.06.03 11:30,보는내내 손에땀을쥐게함 너무재밌게본영화,10
164,2020.06.03 10:22,내스타일이..아니어서..죄송합니다.. 재미가..없어요..,5
165,2020.06.02 23:30,영화보면서 팝콘 먹다가 체한적은 처음이네요..엄청 쫄립니다..,10
166,2020.05.31 21:53,12세관람가가. 재미있네요^^,8
167,2020.05.31 19:28,실화 바탕이라고 해서 호기심에 보러간 프리즌 이스케이프. 나무로 열쇠 만들어서 감옥 탈출 너무 재미나게 봄,10
168,2020.05.28 21:46,긴장감 실화냐????,9
169,2020.05.28 00:42,"한마디로 정리하자면 ""지혼자만 긴박한 주인공과 멍청한 간수들"". 긴장감을 조여오는 음악과 긴박한 주인공까지는 좋다. 그런데 교도관들 행동을 보면 너무 멍청해서 긴장감이 확 사라진다. 상황자체도 긴박하...",6
170,2020.05.27 19:42,실화 바탕 영화라 스토리는 기막힌 반전이나 특이한 것이 없는데... 좋은 연출과 연기로 관객까지 심쫄하게 만드는 몰입감의 맛이 괜찮다.,7
171,2020.05.26 19:52,평점 처음 남김 보는 내내 심장이 쫄려서 죽는 줄 알았음,8
172,2020.05.25 20:57,훌륭한 연출 그 자체인 영화. 잔가지를 최대한 쳐내려 노력한게 보일 정도로 흥미있는 영화입니다. 배우들의 연기도 강약조절이 잘 되어있어  좋았습니다. 이 정도 수준의 작품을 첫 작품으로 만들었다는게 정말 놀랍습니다. ,8
173,2020.05.25 11:29,"해리포터 형님 연기가 너무 좋았어요 긴장에 덜덜 떠는 모습,...    무서워 죽겠지만 억지로 태연한척 의연한척 하는 모습도 자연스럽고,...    영화 구성도 과하지 않고,...      물론 영화기 때문에 중간 중간 언뜻 보기에 실화라고 보기에는 무리가 있어보이는 내용도 좀 있었지만,...   또 어떻게 보면 영화보다 더 영화 같은 일도 있는게 현실이라고 생가하니 납득이 가기도 합니다....      감옥에 갇힌 절망감,...     나가고 싶은 간절함도,.. 어느정도 잘 표현되었고,     비슷 비슷한 장면들이 겹치는 부분이 많지만,...   중간 중간   긴장 요소도    적절하게 잘 배치했다고 봅니다....     다니엘 레드클리프 형님이   캐리한    재밌는 영화였습니다. ",8
174,2020.05.25 04:06,OOO재밌는데 심장쫄리고 왜 평점이 9점이상이 아님???ㅋㅋㅋ,10
175,2020.05.25 02:19,가슴 졸이며 봤다 아그들아~,9
176,2020.05.24 18:54,오랫만에 잘봄....,8
177,2020.05.24 17:20,결말이 뻔함에도 쫄깃쫄깃,8
178,2020.05.23 20:31,긴장감 넘치는 탈출 스릴을 즐겨보고 싶다면 이 영화를 선택하는데 망설일 필요가 없다.,9
179,2020.05.23 00:37,재밌게 봤어요~보고나니 이후에 주인공들이 어떻게 움직이고 행동했는지 후속편이 나왔으면 좋겠어요~~,8
180,2020.05.20 18:38,스릴넘치는 긴장감 숨도못쉬어요,10
181,2020.05.20 13:00,생각보다 흥미진진 손에땀을쥐게함,9
